{
  "$schema": "https://json-schema.org/draft/2020-12/schema",
  "$id": "https://github.com/howdeploy/CanvasTTY/blob/main/docs/canvastty-plugin.schema.json",
  "title": "CanvasTTY plugin manifest v1",
  "type": "object",
  "additionalProperties": false,
  "required": ["apiVersion", "id", "name", "version", "description", "permissions", "contributions"],
  "properties": {
    "apiVersion": { "const": 1 },
    "id": { "type": "string", "minLength": 3, "maxLength": 80, "pattern": "^(?!.*\\.\\.)[a-z0-9](?:[a-z0-9.-]*[a-z0-9])?$" },
    "name": { "type": "string", "minLength": 1, "maxLength": 80 },
    "version": { "type": "string", "maxLength": 40, "pattern": "^\\d+\\.\\d+\\.\\d+(?:-[0-9A-Za-z.-]+)?$" },
    "description": { "type": "string", "minLength": 1, "maxLength": 280 },
    "author": { "type": "string", "minLength": 1, "maxLength": 120 },
    "homepage": { "type": "string", "format": "uri", "maxLength": 300, "pattern": "^https?://" },
    "settingsContribution": { "type": "string", "minLength": 1, "maxLength": 64, "pattern": "^[a-z0-9](?:[a-z0-9._-]*[a-z0-9])?$" },
    "permissions": {
      "type": "array",
      "maxItems": 10,
      "uniqueItems": true,
      "items": { "enum": ["storage", "secrets", "sessions:read", "limits:read", "launcher:open", "external:open", "media:library", "playlists:read", "playlists:write", "network"] }
    },
    "contributions": {
      "type": "array",
      "minItems": 1,
      "maxItems": 32,
      "items": { "$ref": "#/$defs/contribution" }
    }
  },
  "$defs": {
    "baseContribution": {
      "type": "object",
      "additionalProperties": false,
      "required": ["id", "kind", "title", "entry", "defaultSize"],
      "properties": {
        "id": { "type": "string", "minLength": 1, "maxLength": 64, "pattern": "^[a-z0-9](?:[a-z0-9._-]*[a-z0-9])?$" },
        "kind": { "enum": ["home-widget", "canvas-app", "window"] },
        "title": { "type": "string", "minLength": 1, "maxLength": 80 },
        "description": { "type": "string", "minLength": 1, "maxLength": 240 },
        "entry": { "type": "string", "minLength": 1, "maxLength": 180, "pattern": "^(?!/)(?!.*\\\\)(?!\\.\\.?/)(?!.*(?:/\\.\\.?/|/\\.\\.?$|//)).+\\.html$" },
        "icon": { "type": "string", "minLength": 1, "maxLength": 180, "pattern": "^(?!/)(?!.*\\\\)(?!\\.\\.?/)(?!.*(?:/\\.\\.?/|/\\.\\.?$|//)).+$" },
        "defaultSize": { "type": "object" },
        "minSize": { "type": "object" }
      }
    },
    "contribution": {
      "oneOf": [
        {
          "allOf": [
            { "$ref": "#/$defs/baseContribution" },
            {
              "properties": {
                "kind": { "const": "home-widget" },
                "defaultSize": {
                  "type": "object",
                  "additionalProperties": false,
                  "required": ["columns", "rows"],
                  "properties": {
                    "columns": { "type": "integer", "minimum": 1, "maximum": 48 },
                    "rows": { "type": "integer", "minimum": 1, "maximum": 36 }
                  }
                }
              }
            }
          ]
        },
        {
          "allOf": [
            { "$ref": "#/$defs/baseContribution" },
            {
              "properties": {
                "kind": { "enum": ["canvas-app", "window"] },
                "defaultSize": {
                  "type": "object",
                  "additionalProperties": false,
                  "required": ["width", "height"],
                  "properties": {
                    "width": { "type": "number", "minimum": 320, "maximum": 1600 },
                    "height": { "type": "number", "minimum": 220, "maximum": 1100 }
                  }
                },
                "minSize": {
                  "type": "object",
                  "additionalProperties": false,
                  "required": ["width", "height"],
                  "properties": {
                    "width": { "type": "number", "minimum": 240, "maximum": 1600 },
                    "height": { "type": "number", "minimum": 140, "maximum": 1100 }
                  }
                }
              }
            }
          ]
        }
      ]
    }
  }
}
